<?xml version="1.0" encoding="UTF-8"?>
<daoTool xmlns:xsi="http://www.w3.org/2001/XMLSchema-instance"
	xsi:noNamespaceSchemaLocation="./metadata/jaxb/DAOTool.xsd">

	<filePath>metadata/gen</filePath>
	<project>com.ilink.server</project>
	<modules>
		<module>
			<name>account</name>
			<model>
				<name>accountXmpp</name>
				<table>t_account_xmpp</table>
				<prop><name>password2</name><type>String</type></prop>
				<prop><name>username</name><type>String</type></prop>
				<prop><name>type</name><type>String</type></prop>
				<prop><name>domain</name><type>String</type></prop>
				<prop><name>resource</name><type>String</type></prop>
			</model>
			<model>
				<name>accountTwitter</name>
				<table>t_account_twitter</table>
				<prop><name>password2</name><type>String</type></prop>
				<prop><name>username</name><type>String</type></prop>
				<prop><name>type</name><type>String</type></prop>
				<prop><name>domain</name><type>String</type></prop>
				<prop><name>oauth_token</name><type>String</type><null>true</null></prop>
				<prop><name>oauth_secret</name><type>String</type><null>true</null></prop>
				<prop><name>uid</name><type>Integer</type></prop>
			</model>
			<model>
				<name>accountBindingXTwitter</name>
				<table>t_account_binding_xt</table>
				<prop><name>account_xmpp_id</name><type>Integer</type></prop>
				<prop><name>account_twitter_id</name><type>Integer</type></prop>
			</model>
		</module>
		<module>
			<name>app</name>
			<model>
				<name>app</name>
				<table>t_app</table>
				<prop><name>name</name><type>String</type></prop>
				<prop><name>namecn</name><type>String</type><null>true</null></prop>
				<prop><name>type</name><type>String</type></prop>
				<prop><name>logo</name><type>String</type><null>true</null></prop>
				<prop><name>available</name><type>Integer</type></prop>
			</model>
		</module>
		<module>
			<name>job</name>
			<model>
				<name>jobTSinaTweetStat</name>
				<table>t_job_tsina_tweet_stat</table>
				<prop><name>tids</name><type>String</type></prop>
				<prop><name>status</name><type>Integer</type></prop>
				<prop><name>version</name><type>Timestamp</type></prop>
			</model>
		</module>
		<module>
			<name>twitterSina</name>
			<model>
				<name>twitterSinaUser</name>
				<table>t_twitter_sina_user</table>
				<prop><name>uid</name><type>Integer</type></prop>
				<prop><name>name</name><type>String</type></prop>
				<prop><name>location</name><type>String</type><null>true</null></prop>
				<prop><name>url</name><type>String</type><null>true</null></prop>
				<prop><name>city</name><type>Integer</type><null>true</null></prop>
				<prop><name>description</name><type>String</type><null>true</null></prop>
				<prop><name>tweet_count</name><type>Integer</type><null>true</null></prop>
				<prop><name>follow_count</name><type>Integer</type><null>true</null></prop>
				<prop><name>fans_count</name><type>Integer</type><null>true</null></prop>
				<prop><name>favourite_count</name><type>Integer</type><null>true</null></prop>
				<prop><name>province</name><type>Integer</type><null>true</null></prop>
				<prop><name>domain</name><type>String</type><null>true</null></prop>
				<prop><name>create_date</name><type>Date</type></prop>
				<prop><name>gender</name><type>String</type><null>true</null></prop>
				<prop><name>profile_image_url</name><type>String</type><null>true</null></prop>
				<prop><name>verified</name><type>Integer</type><null>true</null></prop>
				<prop><name>screen_name</name><type>String</type></prop>
				<prop><name>version</name><type>Timestamp</type></prop>
			</model>
			<model>
				<name>twitterSinaTweet</name>
				<table>t_twitter_sina_tweet</table>
				<prop><name>tid</name><type>Long</type></prop>
				<prop><name>uid</name><type>Integer</type></prop>
				<prop><name>content</name><type>String</type></prop>
				<prop><name>bmiddle_pic</name><type>String</type><null>true</null></prop>
				<prop><name>thumbnail_pic</name><type>String</type><null>true</null></prop>
				<prop><name>original_pic</name><type>String</type><null>true</null></prop>
				<prop><name>source</name><type>String</type><null>true</null></prop>
				<prop><name>create_date</name><type>Date</type></prop>
				<prop><name>retid</name><type>Long</type></prop>
			</model>
			<model>
				<name>twitterSinaInbox</name>
				<table>t_twitter_sina_inbox</table>
				<prop><name>tid</name><type>Long</type></prop>
				<prop><name>uid</name><type>Integer</type></prop>
				<prop><name>create_date</name><type>Date</type></prop>
				<prop><name>version</name><type>Timestamp</type></prop>
			</model>
			<model>
				<name>twitterSinaTweetStat</name>
				<table>t_twitter_sina_tweet_stat</table>
				<prop><name>favourite_count</name><type>Long</type><null>true</null></prop>
				<prop><name>repost_count</name><type>Long</type><null>true</null></prop>
				<prop><name>comment_count</name><type>Long</type><null>true</null></prop>
				<prop><name>tid</name><type>Long</type></prop>
				<prop><name>version</name><type>Timestamp</type></prop>
			</model>
			<model>
				<name>twitterSinaDailyRank</name>
				<table>t_twitter_sina_daily_rank</table>
				<prop><name>tid</name><type>Long</type></prop>
				<prop><name>uid</name><type>Integer</type></prop>
				<prop><name>version</name><type>Timestamp</type></prop>
				<prop><name>rank</name><type>Float</type><null>true</null></prop>
				<prop><name>date_tag</name><type>Integer</type></prop>
			</model>
			<model>
				<name>twitterSinaDailySend</name>
				<table>t_twitter_sina_daily_send</table>
				<prop><name>tid</name><type>Long</type></prop>
				<prop><name>uid</name><type>Integer</type></prop>
				<prop><name>version</name><type>Timestamp</type></prop>
				<prop><name>date_tag</name><type>Integer</type></prop>
			</model>
			<model>
				<name>twitterSinaDailyHistory</name>
				<table>t_twitter_sina_daily_history</table>
				<prop><name>tid</name><type>Long</type></prop>
				<prop><name>uid</name><type>Integer</type></prop>
				<prop><name>version</name><type>Timestamp</type></prop>
				<prop><name>rank</name><type>Float</type><null>true</null></prop>
				<prop><name>date_tag</name><type>Integer</type></prop>
			</model>
			<model>
				<name>twitterSinaDailyBlack</name>
				<table>t_twitter_sina_daily_black</table>
				<prop><name>tid</name><type>Long</type></prop>
				<prop><name>uid</name><type>Integer</type></prop>
				<prop><name>version</name><type>Timestamp</type></prop>
				<prop><name>date_tag</name><type>Integer</type></prop>
			</model>
			<model>
				<name>twitterSinaUserRelate</name>
				<table>t_twitter_sina_user_relate</table>
				<prop><name>uid</name><type>Integer</type></prop>
				<prop><name>fansid</name><type>Integer</type></prop>
				<prop><name>version</name><type>Timestamp</type></prop>
			</model>
			<model>
				<name>twitterSinaFavorite</name>
				<table>t_twitter_sina_favorite</table>
				<prop><name>tid</name><type>Long</type></prop>
				<prop><name>uid</name><type>Integer</type></prop>
				<prop><name>ownerid</name><type>Integer</type></prop>
				<prop><name>version</name><type>Timestamp</type></prop>
			</model>
			<model>
				<name>twitterSinaComment</name>
				<table>t_twitter_sina_comment</table>
				<prop><name>cid</name><type>Long</type></prop>
				<prop><name>tid</name><type>Long</type></prop>
				<prop><name>uid</name><type>Integer</type></prop>
				<prop><name>ownerid</name><type>Integer</type></prop>
				<prop><name>comment</name><type>String</type></prop>
				<prop><name>create_date</name><type>Date</type></prop>
				<prop><name>source</name><type>String</type><null>true</null></prop>
				<prop><name>version</name><type>Timestamp</type></prop>
			</model>
			<model>
				<name>twitterSinaPmsg</name>
				<table>t_twitter_sina_pmsg</table>
				<prop><name>mid</name><type>Integer</type></prop>
				<prop><name>uid</name><type>Integer</type></prop>
				<prop><name>receiverid</name><type>Integer</type></prop>
				<prop><name>msg</name><type>String</type></prop>
				<prop><name>create_date</name><type>Date</type></prop>
				<prop><name>version</name><type>Timestamp</type></prop>
			</model>
			
			<model>
				<name>twitterSinaRepost</name>
				<table>t_twitter_sina_repost</table>
				<prop><name>tid</name><type>Long</type></prop>
				<prop><name>uid</name><type>Integer</type></prop>
				<prop><name>retid</name><type>Long</type></prop>
				<prop><name>ownerid</name><type>Integer</type></prop>
				<prop><name>create_date</name><type>Date</type></prop>
				<prop><name>version</name><type>Timestamp</type></prop>
			</model>
			<model>
				<name>twitterSinaAt</name>
				<table>t_twitter_sina_at</table>
				<prop><name>tid</name><type>Long</type></prop>
				<prop><name>ownerid</name><type>Integer</type></prop>
				<prop><name>uid</name><type>Integer</type></prop>
				<prop><name>name</name><type>String</type></prop>
				<prop><name>create_date</name><type>Date</type></prop>
				<prop><name>version</name><type>Timestamp</type></prop>
			</model>
			<model>
				<name>twitterSinaConfig</name>
				<table>t_twitter_sina_config</table>
				<prop><name>name</name><type>String</type></prop>
				<prop><name>description</name><type>String</type><null>true</null></prop>
				<prop><name>value</name><type>String</type></prop>
			</model>
		</module>
	</modules>
</daoTool>