<?xml version="1.0" encoding="UTF-8"?>
<daoTool xmlns:xsi="http://www.w3.org/2001/XMLSchema-instance"
	xsi:noNamespaceSchemaLocation="./metadata/jaxb/DAOTool.xsd">

	<filePath>metadata/comp</filePath>
	<project>org.conan.dm</project>
	<dbname>competition</dbname>
	<dbtype>mysql</dbtype>
	
	<modules>
        <module>
            <name>quiz</name>
            <model>
                <name>quiz</name>
                <table>t_quiz</table>
                <prop><name>title</name><type>varchar(16)</type></prop>
                <prop><name>content</name><type>mediumtext</type><null>true</null></prop>
                <prop><name>create_date</name><type>timestamp</type><default>now()</default><null>true</null></prop>
                <prop><name>end_date</name><type>timestamp</type><null>true</null></prop>
                <prop><name>uid</name><type>int</type></prop>
            </model>
            <model>
                <name>quizData</name>
                <table>t_quiz_data</table>
                <prop><name>qid</name><type>int</type></prop>
                <prop><name>type</name><type>int</type></prop>
                <prop><name>file</name><type>varchar(512)</type></prop>
                <prop><name>local</name><type>varchar(512)</type></prop>
                <prop><name>create_date</name><type>timestamp</type><default>now()</default><null>true</null></prop>
            </model>
            <model>
                <name>quizSubmit</name>
                <table>t_quiz_submit</table>
                <prop><name>qid</name><type>int</type></prop>
                <prop><name>lang</name><type>varchar(16)</type><default>R</default><null>true</null></prop>
                <prop><name>code</name><type>mediumtext</type></prop>
                <prop><name>create_date</name><type>timestamp</type><default>now()</default><null>true</null></prop>
                <prop><name>uid</name><type>int</type></prop>
                <prop><name>status</name><type>int</type><default>0</default><null>true</null></prop>
                <prop><name>result</name><type>int</type><default>0</default><null>true</null></prop>
            </model>
        </module>
	</modules>
</daoTool>